{
  "$schema": "https://json-schema.org/draft/2020-12/schema",
  "$id": "https://raw.githubusercontent.com/open-logistics-tracking/OpenLogisticsTrackingSchema/main/schemas/v0.2/tracking-event.json",
  "title": "OLTS TrackingEvent",
  "description": "A normalized logistics tracking event. OLTS v0.2 draft.",
  "type": "object",
  "required": ["eventTime", "oltsCode"],
  "additionalProperties": false,
  "properties": {
    "eventTime": {
      "type": "string",
      "format": "date-time",
      "description": "ISO 8601 timestamp with explicit timezone offset (e.g. 2024-06-03T11:38:00+07:00). UTC (Z) is allowed but explicit offsets are preferred to preserve local context — many domestic Chinese carriers return timestamps without offset; consumers SHOULD attach the carrier's home timezone before persisting."
    },
    "carrierCode": {
      "type": "string",
      "description": "Slug identifying the carrier. SHOULD match the directory naming used in mappings/ (e.g. 'yto', 'sf', 'dhl').",
      "examples": [
        "yto", "zto", "sto", "yunda", "sf", "jdl", "ems",
        "jtexpress", "cainiao", "deppon",
        "dhl", "fedex", "ups", "usps"
      ]
    },
    "carrierEventCode": {
      "type": "string",
      "description": "Raw event/status code as returned by the carrier API (e.g. 'GOT', '01', 'opcode:100', 'DLVRD:ACCPT'). Look up its mapping in mappings/<region>/<carrier>.csv."
    },
    "oltsCode": {
      "$ref": "#/$defs/UlscCode",
      "description": "Normalized OLTS status code from the ULSC dictionary. MUST be one of the 32 codes in ulsc/ulsc.csv."
    },
    "description": {
      "oneOf": [
        { "type": "string" },
        {
          "type": "object",
          "patternProperties": {
            "^[a-z]{2}(-[A-Z]{2})?$": { "type": "string" }
          },
          "additionalProperties": false,
          "minProperties": 1
        }
      ],
      "description": "Human-readable event description. Either a single string or a multilingual object keyed by BCP 47 tag (e.g. {'zh': '...', 'en': '...'})."
    },
    "location": {
      "type": "object",
      "additionalProperties": false,
      "properties": {
        "name": {
          "type": "string",
          "description": "Facility / network point name in local language (e.g. '上海浦东转运中心', 'Frankfurt Airport Hub')."
        },
        "city": { "type": "string" },
        "state": { "type": "string", "description": "State, province or region." },
        "country": { "type": "string", "description": "Country name in local language." },
        "countryCode": {
          "type": "string",
          "pattern": "^[A-Z]{2}$",
          "description": "ISO 3166-1 alpha-2 country code (e.g. 'CN', 'US', 'DE')."
        },
        "postalCode": { "type": "string" },
        "coordinates": {
          "type": "object",
          "additionalProperties": false,
          "required": ["latitude", "longitude"],
          "properties": {
            "latitude":  { "type": "number", "minimum":  -90, "maximum":  90 },
            "longitude": { "type": "number", "minimum": -180, "maximum": 180 }
          }
        }
      },
      "description": "Structured location of the event. All fields optional; provide what the carrier returns."
    },
    "operator": {
      "type": "object",
      "additionalProperties": false,
      "properties": {
        "name":  { "type": "string" },
        "phone": { "type": "string" },
        "code":  { "type": "string", "description": "Operator / courier ID assigned by the carrier." }
      },
      "description": "The person who performed the operation (courier, signing party, etc.). Phone numbers SHOULD be masked when the carrier API masks them."
    },
    "pieceId": {
      "type": "string",
      "description": "Identifier of the specific piece within a multi-piece shipment. Omit for shipment-level events. DHL and UPS APIs expose per-piece tracking; domestic Chinese carriers usually don't."
    },
    "transport": {
      "type": "object",
      "additionalProperties": false,
      "properties": {
        "mode": {
          "type": "string",
          "enum": ["AIR", "SEA", "RAIL", "ROAD", "MULTIMODAL", "UNKNOWN"]
        },
        "vehicleNumber": {
          "type": "string",
          "description": "Flight number / vessel name / truck plate / container number — whatever the carrier exposes."
        },
        "operatingCarrier": {
          "type": "string",
          "description": "Operating carrier identifier (airline IATA code, shipping line SCAC, etc.) for multi-leg shipments."
        }
      },
      "description": "Transport mode and conveyance details. Useful for cross-border / multimodal shipments; many domestic events leave this absent."
    },
    "isLogicalEvent": {
      "type": "boolean",
      "default": false,
      "description": "true if the event is system-generated (derived status, polling artifact), false if it represents a physical scan. UPS exposes this as 'logicalScan' on activity records."
    },
    "notes": {
      "type": "string",
      "description": "Free-form additional context not captured in other fields (e.g. carrier-specific sub-reason, mapping decision rationale)."
    },
    "metadata": {
      "type": "object",
      "additionalProperties": true,
      "description": "Carrier-specific extension fields. Consumers SHOULD treat as opaque unless they know the carrier's schema (e.g. EMS妥投代码细分, 顺丰 routeFrom/routeTo)."
    }
  },
  "$defs": {
    "UlscCode": {
      "type": "string",
      "enum": [
        "order_created", "order_cancelled", "label_printed",
        "pickup_scheduled", "picked_up", "pickup_failed",
        "arrived_at_hub", "departed_from_hub", "in_transit",
        "transferred_to_carrier", "arrived_at_destination",
        "customs_declared", "customs_held", "customs_inspection",
        "customs_released", "customs_duty_paid", "clearance_completed",
        "out_for_delivery", "delivery_attempted", "delivered",
        "delivery_to_locker", "awaiting_pickup", "signed_by_third_party",
        "exception", "damaged", "lost", "address_issue",
        "recipient_unavailable", "refused",
        "return_initiated", "in_return_transit", "returned_to_sender"
      ],
      "description": "ULSC v0.1 dictionary — 32 codes across 7 categories. Authoritative source: ulsc/ulsc.csv."
    }
  }
}
